{
  "$schema": "https://json-schema.org/draft/2020-12/schema",
  "$id": "https://jason.teamaot.local/schemas/cap-001/investigation-request.schema.json",
  "title": "CAP-001 Investigation Request",
  "type": "object",
  "additionalProperties": false,
  "required": ["schema_version", "request_id", "correlation_id", "execution_context", "ticket"],
  "properties": {
    "schema_version": {"const": "0.1"},
    "request_id": {"type": "string", "minLength": 1},
    "correlation_id": {"type": "string", "minLength": 1},
    "execution_context": {
      "type": "object",
      "additionalProperties": false,
      "required": ["context_id", "requester_id", "organization_id", "client_id", "capability", "maximum_mode", "expires_at"],
      "properties": {
        "context_id": {"type": "string", "minLength": 1},
        "requester_id": {"type": "string", "minLength": 1},
        "organization_id": {"type": "string", "minLength": 1},
        "client_id": {"type": "string", "minLength": 1},
        "capability": {"const": "ticket.investigate"},
        "maximum_mode": {"enum": ["observe", "recommend"]},
        "expires_at": {"type": "string", "format": "date-time"}
      }
    },
    "ticket": {
      "type": "object",
      "additionalProperties": false,
      "required": ["provider", "external_id", "title", "description", "client_id", "created_at"],
      "properties": {
        "provider": {"type": "string", "minLength": 1},
        "external_id": {"type": "string", "minLength": 1},
        "title": {"type": "string", "minLength": 1},
        "description": {"type": "string"},
        "client_id": {"type": "string", "minLength": 1},
        "configuration_item_id": {"type": ["string", "null"]},
        "requester_identity_id": {"type": ["string", "null"]},
        "created_at": {"type": "string", "format": "date-time"},
        "attachments": {"type": "array", "items": {"type": "string"}}
      }
    },
    "requested_depth": {"enum": ["initial", "standard", "extended"], "default": "standard"}
  }
}
